{
  "version": "1.0",
  "project_name": "my-awesome-app",
  "created_at": "2026-02-22T10:30:00Z",
  "targets": {
    "docker": {
      "enabled": true,
      "primary": true,
      "config": {
        "image_name": "my-awesome-app",
        "registry": "ghcr.io",
        "build_context": ".",
        "dockerfile": "Dockerfile",
        "platforms": ["linux/amd64", "linux/arm64"],
        "tags": ["latest", "{{version}}"],
        "build_args": {
          "NODE_ENV": "production"
        }
      }
    },
    "npm": {
      "enabled": true,
      "primary": false,
      "config": {
        "registry": "https://registry.npmjs.org",
        "access": "public",
        "tag": "latest",
        "dry_run": false
      }
    },
    "github_releases": {
      "enabled": true,
      "primary": false,
      "config": {
        "release_notes_source": "changelog",
        "draft": false,
        "prerelease": false,
        "assets": [
          {
            "path": "dist/my-awesome-app-linux",
            "name": "my-awesome-app-linux-x64"
          },
          {
            "path": "dist/my-awesome-app-macos",
            "name": "my-awesome-app-macos-x64"
          }
        ]
      }
    }
  },
  "ci": {
    "provider": "github_actions",
    "triggers": {
      "push": ["main"],
      "pull_request": ["main"],
      "tag": ["v*"]
    },
    "manual_only": false,
    "workflow_dispatch": true
  },
  "history": [
    {
      "timestamp": "2026-02-21T15:45:00Z",
      "target": "docker",
      "version": "1.2.0",
      "status": "success",
      "commit_sha": "abc123def456",
      "duration_ms": 45000
    },
    {
      "timestamp": "2026-02-20T09:30:00Z",
      "target": "npm",
      "version": "1.1.0",
      "status": "success",
      "commit_sha": "def789ghi012",
      "duration_ms": 12000
    }
  ]
}
